{
  "$schema": "./skill.schema.json",
  "schemaVersion": "1.1",
  "id": "property-based-testing",
  "name": "Property-based testing",
  "description": "Test whole classes of inputs instead of hand-picked examples: state properties (round trips, invariants, oracles, idempotence), let Hypothesis (Python) or FsCheck/CsCheck (.NET) generate and shrink inputs, and keep failing cases as regression examples. Use for parsers, serializers, algorithms and anything with rules that hold for every input.",
  "tags": [
    "testing",
    "python",
    "dotnet"
  ],
  "content": "# Property-based testing\n\nInstead of \"for input X expect Y\", say what must be true for **every** input and let the library hunt for a counterexample. It complements example tests; it doesn't replace them.\n\n## Good properties\n\n- **Round trip**: `parse(format(x)) == x`; `deserialize(serialize(x)) == x`.\n- **Invariant**: the output of `sort` is ordered and a permutation of the input; a balance never goes negative.\n- **Oracle**: the fast version agrees with a slow, obviously-correct one.\n- **Idempotence**: `normalize(normalize(x)) == normalize(x)`.\n- **Metamorphic**: changing the input in a known way changes the output in a known way (adding an item never lowers the total).\n- **Doesn't crash**: any input gives a result or the documented error, never an unexpected exception.\n\nAvoid properties that re-implement the code under test; they share its bugs.\n\n## Python: Hypothesis\n\n`uv add --dev hypothesis`.\n\n```python\nfrom hypothesis import example, given, strategies as st\n\n@given(st.lists(st.integers()))\n@example([])  # keep known edge cases and past failures explicit\ndef test_sort_orders_and_keeps_items(xs: list[int]) -> None:\n    out = my_sort(xs)\n    assert all(a <= b for a, b in zip(out, out[1:]))\n    assert sorted(xs) == sorted(out)\n```\n\n- Build domain values with `st.builds(Order, ...)` or `@st.composite`, constrained to what's valid, rather than filtering with `assume` (which wastes runs).\n- For things with state (a cache, a queue, an API), use `hypothesis.stateful.RuleBasedStateMachine` to generate sequences of operations and check invariants after each.\n- Set a `deadline` or turn it off for slow code; use profiles (`settings.register_profile`) for more examples in CI than locally.\n\n## .NET: FsCheck or CsCheck\n\n- FsCheck with `FsCheck.Xunit` (`[Property]` test methods with generated parameters), or CsCheck (`Gen.Int.Array.Sample(xs => ...)`), whichever the repo uses.\n- Write custom generators for domain types instead of generating primitives and converting by hand.\n\n## When it fails\n\n- The library **shrinks** the input to a minimal failing case. Read that case: it usually points straight at the bug.\n- Fix the bug, then add the shrunk input as an explicit example (`@example`, or an `[InlineData]` test) so it's checked on every run.\n- Failures must be reproducible: Hypothesis keeps a local example database; with .NET libraries, log and pin the seed.\n- Don't widen the generator's filters just to make a failure go away.\n"
}
