{
  "$schema": "./skill.schema.json",
  "schemaVersion": "1.1",
  "id": "security-diff-review",
  "name": "Security review of a change",
  "description": "Review a diff for security impact: what new input reaches what sensitive operation, removed or weakened checks, auth, injection, secrets, deserialization, paths and dependencies, with the blast radius found by tracing callers. Findings ranked by severity with evidence. Use for security review steps on a branch or PR.",
  "tags": [
    "security",
    "review"
  ],
  "content": "# Security review of a change\n\nReview the change, not the whole codebase, but follow it as far as it reaches.\n\n## 1. Understand the change\n\n- Read the diff (`git diff <base>...HEAD`) and the ticket or PR description. Write one sentence on what the change is for.\n- For each changed file, note whether it touches a **trust boundary**: HTTP handlers, CLI arguments, file or message parsing, auth, database queries, shell commands, crypto, secrets, permissions, or dependency manifests.\n- For risky edits, check the history of the lines (`git log -L`, `git blame`): a check that's being removed may exist because of a past bug.\n\n## 2. Trace the reach\n\n- For each changed function on a boundary, find its callers (references, `grep`) and what data flows in. A small change in a shared helper can have a large blast radius.\n- Ask: can data an attacker controls now reach something it couldn't before, or reach it with fewer checks?\n\n## 3. Check the usual suspects\n\n- **Removed or weakened checks**: deleted validation, an `if` loosened, an auth attribute or middleware removed, a default flipped to permissive, error handling that now fails open.\n- **Auth**: new endpoints or commands without authentication or authorisation; checks done on the client or only in the UI; IDs taken from the request without checking ownership.\n- **Injection**: SQL built from strings (values must be bound parameters, see `python-raw-sql`), shell commands built from input, template or HTML injection, log injection.\n- **Paths and files**: user input in file paths without normalising and checking the root (traversal), archive extraction, temp files with predictable names or loose permissions.\n- **Deserialisation and parsing**: polymorphic or type-name deserialisation of untrusted data, XML with external entities, unbounded sizes or recursion.\n- **Secrets**: keys or tokens in code, config, tests or logs; secrets in URLs or exception messages.\n- **Crypto and randomness**: home-made crypto, weak hashes for passwords, non-cryptographic random for tokens, disabled certificate checks.\n- **Dependencies**: new or upgraded packages (are they the real package, maintained, needed?), and new network calls to third parties.\n- **Concurrency**: check-then-act races around money, permissions or files.\n\n## 4. Check the tests\n\n- Is there a test showing the bad case is rejected (wrong user, malformed input, oversized payload), not only that the happy path works? Missing negative tests are a finding.\n\n## 5. Report\n\n- Findings ranked **critical / high / medium / low**, each with: file and line, what an attacker could do, the evidence (the path from input to sink), and the fix.\n- Say what you checked and found fine, and what you couldn't check (code outside the repo, runtime config), so the reader knows the coverage.\n- Don't pad the report with generic advice; if the change is safe, say so plainly.\n"
}
